<?xml version="1.0"?>

<xs:schema

xmlns:xs="http://www.w3.org/2001/XMLSchema">


    <xs:element name="Library">

        <xs:complexType>

            <xs:sequence>

                <xs:element

                name="Book"

                maxOccurs="unbounded">


                    <xs:complexType>

                        <xs:sequence>

                            <xs:element

                            name="BookID"

                            type="xs:integer"/>


                            <xs:element

                            name="Title"

                            type="xs:string"/>


                            <xs:element

                            name="Author"

                            type="xs:string"/>


                            <xs:element

                            name="Genre"

                            type="xs:string"/>


                            <xs:element

                            name="PublishedYear">

                                <xs:simpleType>

                                    <xs:restriction
                                    base="xs:string">

                                        <xs:pattern
                                        value="[0-9]{4}"/>

                                    </xs:restriction>

                                </xs:simpleType>

                            </xs:element>


                            <xs:element

                            name="Price"

                            type="xs:decimal"/>

                        </xs:sequence>

                    </xs:complexType>

                </xs:element>

            </xs:sequence>

        </xs:complexType>

    </xs:element>

</xs:schema>